1503945022,http://ecx.images-amazon.com/images/I/51RxQEhtYyL.jpg,Her Final Breath (The Tracy Crosswhite Series),Robert Dugoni,Mystery & Thriller & Suspense
972467637,http://ecx.images-amazon.com/images/I/51kOYa-LHML.jpg,The Multiples Manual: Preparing and Caring for Twins or Triplets,Lynn Lorenz,Parenting & Relationships
399168834,http://ecx.images-amazon.com/images/I/41TQKcxPcIL.jpg,Brainstorm: The Power and Purpose of the Teenage Brain,Daniel J. Siegel MD,Parenting & Relationships
1285431324,http://ecx.images-amazon.com/images/I/51h8G3giyJL.jpg,Sociology: The Essentials; 8th Edition,Margaret L. Andersen,Politics & Social Sciences
1118306341,http://ecx.images-amazon.com/images/I/61y1faqF0qL.jpg,Creating Exhibitions: Collaboration in the Planning; Development; and Design of Innovative Experiences,Polly McKenna-Cress,Politics & Social Sciences
78038367,http://ecx.images-amazon.com/images/I/51f6b9dBWCL.jpg,How to Think About Weird Things: Critical Thinking for a New Age,Theodore Schick,Politics & Social Sciences
163431056X,http://ecx.images-amazon.com/images/I/41V-Gn%2Bb2HL.jpg,How to Defend the Christian Faith: Advice from an Atheist,John W. Loftus,Politics & Social Sciences
1853264709,http://ecx.images-amazon.com/images/I/51kK3GVzfBL.jpg,Key Philosophical Writings (Wordsworth Classics of World Literature) (Wadsworth Classics of World Literature),Rene Descartes,Politics & Social Sciences
268017409,http://ecx.images-amazon.com/images/I/41iZTQ220KL.jpg,The Spirit of Mediaeval Philosophy,Etienne Gilson,Politics & Social Sciences
842524665,http://ecx.images-amazon.com/images/I/51R7SBsuPHL.jpg,The Incoherence of the Philosophers; 2nd Edition (Brigham Young University - Islamic Translation Series),Abu Hamid Muhammad al-Ghazali,Politics & Social Sciences
3319207016,http://ecx.images-amazon.com/images/I/41cYTBR-obL.jpg,Humanities Data in R: Exploring Networks; Geospatial Data; Images; and Text (Quantitative Methods in the Humanities and Social Sciences),Taylor Arnold,Politics & Social Sciences
465011527,http://ecx.images-amazon.com/images/I/517tfBtUjwL.jpg,America and the Pill: A History of Promise; Peril; and Liberation,Elaine Tyler May,Politics & Social Sciences
262540428,http://ecx.images-amazon.com/images/I/31apvG651rL.jpg,Elbow Room: The Varieties of Free Will Worth Wanting,Daniel C. Dennett,Politics & Social Sciences
1580237959,http://ecx.images-amazon.com/images/I/51pum0eWe4L.jpg,A Partner in Holiness: Deepening Mindfulness; Practicing Compassion and Enriching Our Lives Through the Wisdom of R. Levi Yitzhak of Berdichev's; Vol. 2  (Institute for Jewish Spirituality),Rabbi Jonathan P. Slater DMin,Religion & Spirituality
1557044686,http://ecx.images-amazon.com/images/I/410oYwwjssL.jpg,The Words of Gandhi (Newmarket Words Of Series),Mahatma Gandhi,Religion & Spirituality
983346666,http://ecx.images-amazon.com/images/I/61Yo1Mi1JOL.jpg,She Appears! Encounters with Kwan Yin; Goddess of Compassion,Sandy Boucher,Religion & Spirituality
