135137829,http://ecx.images-amazon.com/images/I/51PuTPPCxaL.jpg,Construction Scheduling: Principles and Practices (2nd Edition),Jay S. Newitt,Arts & Photography
393730018,http://ecx.images-amazon.com/images/I/51BLmSCM6dL.jpg,The Handbook of Painted Decoration: The Tools; Materials; and Step-by-Step Techniques of Trompe L'Oeil Painting,Yannick Guegan,Arts & Photography
1419713930,http://ecx.images-amazon.com/images/I/51c2TA1x6NL.jpg,The Life and Love of Dogs,Lewis Blackwell,Arts & Photography
300047997X,http://ecx.images-amazon.com/images/I/41Mqp%2BCRhJL.jpg,Stephen Irwin,Vince Aletti,Arts & Photography
1608875431,http://ecx.images-amazon.com/images/I/61Nco%2BF3jsL.jpg,In a World of Gods and Goddesses: The Mystic Art of Indra Sharma,James H. Bae,Arts & Photography
1633220168,http://ecx.images-amazon.com/images/I/61o2oN8JNFL.jpg,Creative Painting & Beyond: Inspiring tips; techniques; and ideas for creating whimsical art in acrylic; watercolor; gold leaf; and more (Creative...and Beyond),Alix Adams,Arts & Photography
081099285X,http://ecx.images-amazon.com/images/I/41kdgK2BsqL.jpg,Aircraft: The Jet as Art,Jeffrey Milstein,Arts & Photography
1840916303,http://ecx.images-amazon.com/images/I/51cyPZGzOfL.jpg,Fifty Bicycles That Changed The World (Design Museum Fifty),Alex Newson,Arts & Photography
1419708619,http://ecx.images-amazon.com/images/I/6102jKVV3PL.jpg,Fashionable Selby,Todd Selby,Arts & Photography
821419730,http://ecx.images-amazon.com/images/I/51xwe2DoXAL.jpg,Asylum on the Hill: History of a Healing Landscape,Katherine Ziff,Arts & Photography
60750715,http://ecx.images-amazon.com/images/I/51p5aUY%2BOKL.jpg,George Balanchine: The Ballet Maker (Eminent Lives),Robert Gottlieb,Biographies & Memoirs
827604386,http://ecx.images-amazon.com/images/I/41LS0LgettL.jpg,Rabbi Israel Salanter and the Mussar Movement: Seeking the Torah of Truth,Immanuel Etkes,Biographies & Memoirs
883165635,http://ecx.images-amazon.com/images/I/51HdaoFLOpL.jpg,Promises Kept: The Life of an Issei Man,Akemi Kikumura-Yano,Biographies & Memoirs
679746323,http://ecx.images-amazon.com/images/I/519FQVMBXNL.jpg,Mao: The Unknown Story,Jung Chang,Biographies & Memoirs
1567404294,http://ecx.images-amazon.com/images/I/51-qMt1dInL.jpg,The Miracle of Castel Di Sangro,Joe McGinniss,Biographies & Memoirs
020559848X,http://ecx.images-amazon.com/images/I/51Sxqm9IOVL.jpg,Jackie Robinson and the American Dilemma (Library of American Biography),John R.M. Wilson,Biographies & Memoirs
385740077,http://ecx.images-amazon.com/images/I/51XjuAK3fOL.jpg,Chinese Cinderella,Adeline Yen Mah,Biographies & Memoirs
891060499,http://ecx.images-amazon.com/images/I/41GT96SX6ML.jpg,Katherine and Isabel: Mother's Light; Daughter's Journey,Frances Wright Saunders,Biographies & Memoirs
755365895,http://ecx.images-amazon.com/images/I/51pwXBRi15L.jpg,David Beckham,David Beckham,Biographies & Memoirs
835609278,http://ecx.images-amazon.com/images/I/51wYA0bu5qL.jpg,The Making of a Healer: Teachings of My Oneida Grandmother,Russell FourEagles,Biographies & Memoirs
316185434,http://ecx.images-amazon.com/images/I/51JFeqcU96L.jpg,The Age of Acquiescence: The Life and Death of American Resistance to Organized Wealth and Power,Steve Fraser,Business & Money
976326817,http://ecx.images-amazon.com/images/I/31VJtBTmfvL.jpg,Be the Ultimate Assistant: A celebrity assistant's secrets to working with any high-powered employer,Bonnie Low-Kramen,Business & Money
133795020,http://ecx.images-amazon.com/images/I/51MyuNfkVGL.jpg,Principles of Marketing (16th Edition) (Newest Edition),Philip T Kotler,Business & Money
1479834769,http://ecx.images-amazon.com/images/I/61tWZaKGBUL.jpg,The Slums of Aspen: Immigrants vs. the Environment in America's Eden (Nation of Nations),Lisa  Sun-Hee Park,Business & Money
1505396603,http://ecx.images-amazon.com/images/I/51gYRiiTRIL.jpg,A Social Security Owner's Manual; 3rd Edition: Your Guide to Social Security Retirement; Dependent's; and Survivor's Benefits,Jim Blankenship,Business & Money
130264652,http://ecx.images-amazon.com/images/I/515JJGFGRJL.jpg,Supply Chain Management: Strategy; Planning and Operations,Sunil Chopra,Business & Money
1412982235,http://ecx.images-amazon.com/images/I/51e8RG1XGcL.jpg,Asset Building & Community Development,Gary P. (Paul) Green,Business & Money
007166470X,http://ecx.images-amazon.com/images/I/51iYt-htMkL.jpg,The Bond Book; Third Edition: Everything Investors Need to Know About Treasuries; Municipals; GNMAs; Corporates; Zeros; Bond Funds; Money Market Funds; and More,Annette Thau,Business & Money
1593601905,http://ecx.images-amazon.com/images/I/51LOEfEiH0L.jpg,The Perfect Resume: Resumes That Work in the New Economy (Get a Job!),Dan Quillen,Business & Money
007786171X,http://ecx.images-amazon.com/images/I/51RY9SGFUEL.jpg,Case Studies in Finance: Managing for Corporate Value Creation (Mcgraw-Hill/Irwin Series in Finance; Insurance and Real Estate),Robert Bruner,Business & Money
1449465269,http://ecx.images-amazon.com/images/I/51g4FFUldvL.jpg,Garfield 2016 Day-to-Day Calendar,Jim Davis,Calendars
789323087,http://ecx.images-amazon.com/images/I/51K1ZC-uDbL.jpg,Will Shortz Presents Sudoku: 365 More Challenging Sudoku Puzzles: 2012 Day-to-Day Calendar,Will Shortz,Calendars
1629055336,http://ecx.images-amazon.com/images/I/611HZnHj8oL.jpg,Keith Haring Wall Calendar (2016),Day Dream,Calendars
545700272,http://ecx.images-amazon.com/images/I/51KyLXczCqL.jpg,A Handful of Stars,Cynthia Lord,Children's Books
147514940,http://ecx.images-amazon.com/images/I/51TI3FwVa%2BL.jpg,Fantasy League,Mike Lupica,Children's Books
688135765,http://ecx.images-amazon.com/images/I/61gCGr0YMzL.jpg,Shortcut,Donald Crews,Children's Books
618428852,http://ecx.images-amazon.com/images/I/51N4hEjfIyL.jpg,United States History  Early Years (Level 5): Houghton Mifflin Social Studies,HOUGHTON MIFFLIN,Children's Books
763652326,http://ecx.images-amazon.com/images/I/51gO81UQHXL.jpg,Mercy Watson: Something Wonky this Way Comes,Kate DiCamillo,Children's Books
613721209,http://ecx.images-amazon.com/images/I/51lXAnDj5RL.jpg,It's St. Patrick's Day (Turtleback School & Library Binding Edition) (Scholastic Reader: Level 1 (Pb)),Rebecca Gomez,Children's Books
545130484,http://ecx.images-amazon.com/images/I/51A2z8I-4DL.jpg,Ready; Freddy! #22: Science Fair Flop,Abby Klein,Children's Books
763669288,http://ecx.images-amazon.com/images/I/512jvo6DxIL.jpg,Beyond Courage: The Untold Story of Jewish Resistance During the Holocaust,Doreen Rappaport,Children's Books
689851928,http://ecx.images-amazon.com/images/I/515fhWsXMTL.jpg,America : A Patriotic Primer,Lynne Cheney,Children's Books
746020619,http://ecx.images-amazon.com/images/I/518GSGH06HL.jpg,Tales of King Arthur (Library of Fantasy & Adventure),Felicity Brooks,Children's Books
9683803148,http://ecx.images-amazon.com/images/I/51j4m1W1FeL.jpg,Medicina Prehispanica De Mexico/Prehispanic Medicine of Mexico (Spanish Edition),Viesca Trevino,Children's Books
544340477,http://ecx.images-amazon.com/images/I/51Bn-lq31uL.jpg,Mary Poppins: 80th Anniversary Collection,Dr. P. L. Travers,Children's Books
830830375,http://ecx.images-amazon.com/images/I/51pnw9xXOtL.jpg,Parables: The Greatest Stories Ever Told (Lifeguide Bible Studies),John White,Christian Books & Bibles
851513743,http://ecx.images-amazon.com/images/I/41oo7KfL5ML.jpg,Sermons on Timothy and Titus (16th-17th Century Facsimile Edition),John Calvin,Christian Books & Bibles
890515808,http://ecx.images-amazon.com/images/I/51SCBOPtu0L.jpg,Your Guide to Zion and Bryce Canyon (True North Series),Mike Oard,Christian Books & Bibles
801870895,http://ecx.images-amazon.com/images/I/41oTzSlSYuL.jpg,On the Backroad to Heaven: Old Order Hutterites; Mennonites; Amish; and Brethren (Center Books in Anabaptist Studies),Donald B. Kraybill,Christian Books & Bibles
1493758292,http://ecx.images-amazon.com/images/I/51rpRrPuNwL.jpg,Unnatural Talent: Creating; Printing and Selling Your Comic in the Digital Age,Jason Brubaker,Comics & Graphic Novels
189729994X,http://ecx.images-amazon.com/images/I/51twr-9ltZL.jpg,Moomin Book Five: The Complete Tove Jansson Comic Strip,Tove Jansson,Comics & Graphic Novels
1849180245,http://ecx.images-amazon.com/images/I/51OHVrByn-L.jpg,Latitude 59 Degrees North: Lady S. Vol. 2,Jean Van Hamme,Comics & Graphic Novels
1626720479,http://ecx.images-amazon.com/images/I/51g46YDTj0L.jpg,The Royal Cup (Last Man),Bastien Vivès,Comics & Graphic Novels
151003076,http://ecx.images-amazon.com/images/I/51sRH4pB%2BcL.jpg,The Curious Sofa: A Pornographic Work by Ogdred Weary,Ogdred Weary,Comics & Graphic Novels
785114823,http://ecx.images-amazon.com/images/I/51KROa77SFL.jpg,Avengers Disassembled,Brian Michael Bendis,Comics & Graphic Novels
1561632112,http://ecx.images-amazon.com/images/I/5140X39JTGL.jpg,Tranceptor: The Way Station (Tranceptor Book One),Micheal Manning,Comics & Graphic Novels
1596914521,http://ecx.images-amazon.com/images/I/51ExA-wU3BL.jpg,Logicomix: An epic search for truth,Apostolos Doxiadis,Comics & Graphic Novels
1632155567,http://ecx.images-amazon.com/images/I/51-XkyG0ReL.jpg,Jupiter's Circle Volume 1 (Jupiters Circle Tp),Mark Millar,Comics & Graphic Novels
596527322,http://ecx.images-amazon.com/images/I/5159f7hqJjL.jpg,HTML & XHTML: The Definitive Guide (6th Edition),Chuck Musciano,Computers & Technology
111801684X,http://ecx.images-amazon.com/images/I/518VXqYR27L.jpg,Microsoft Windows Security Essentials,Darril Gibson,Computers & Technology
1495944336,http://ecx.images-amazon.com/images/I/51b4r8w9r7L.jpg,E-Commerce Concepts,Dr Randall J Dyck,Computers & Technology
1466598689,http://ecx.images-amazon.com/images/I/51wRE04dZ9L.jpg,Mobile & Social Game Design: Monetization Methods and Mechanics; Second Edition,Tim Fields,Computers & Technology
1118091345,http://ecx.images-amazon.com/images/I/51BPjyAxiFL.jpg,iPhone Application Development For Dummies,Neal Goldstein,Computers & Technology
1118215524,http://ecx.images-amazon.com/images/I/514zdYKrw3L.jpg,Social Media Marketing All-in-One For Dummies,Jan Zimmerman,Computers & Technology
985082062,http://ecx.images-amazon.com/images/I/41EwHr9af5L.jpg,What's The Deal With Bitcoins?,Ryan Lancelot,Computers & Technology
1783985127,http://ecx.images-amazon.com/images/I/51mZTnirKuL.jpg,Learning Pandas - Python Data Discovery and Analysis Made Easy,Michael Heydt,Computers & Technology
1568813260,http://ecx.images-amazon.com/images/I/51Y%2BAlb5S-L.jpg,Fluid Simulation for Computer Graphics,Robert Bridson,Computers & Technology
596000669,http://ecx.images-amazon.com/images/I/41yYszE83ZL.jpg,Unix for Oracle Dbas Pocket Reference,Donald K. Burleson,Computers & Technology
133349330,http://ecx.images-amazon.com/images/I/51F0ztgKIGL.jpg,GO! with Microsoft Word 2013 Brief,Shelley Gaskin,Computers & Technology
596514549,http://ecx.images-amazon.com/images/I/51pVtRWu3NL.jpg,Oracle Essentials: Oracle Database 11g,Rick Greenwald,Computers & Technology
201702452,http://ecx.images-amazon.com/images/I/51ARDDYDAVL.jpg,The Design and Implementation of the FreeBSD Operating System,Marshall Kirk McKusick,Computers & Technology
226321487,http://ecx.images-amazon.com/images/I/41PTRRohoeL.jpg,My Mother Was a Computer: Digital Subjects and Literary Texts,N. Katherine Hayles,Computers & Technology
1118893174,http://ecx.images-amazon.com/images/I/51wiYLzUnQL.jpg,Data Mining For Dummies,Meta S. Brown,Computers & Technology
1449317758,http://ecx.images-amazon.com/images/I/51JD4fz4ujL.jpg,NOOK Tablet: The Missing Manual (Missing Manuals),Preston Gralla,Computers & Technology
1598633015,http://ecx.images-amazon.com/images/I/51Bs5b4F8XL.jpg,Creating Music and Sound for Games,G. W. Childs,Computers & Technology
672326876,http://ecx.images-amazon.com/images/I/517B3M5CHWL.jpg,Plone Content Management Essentials,Julie C. Meloni,Computers & Technology
1782168338,http://ecx.images-amazon.com/images/I/51oNBCUQStL.jpg,Extending Microsoft Dynamics AX 2012 Cookbook,Murray Fife,Computers & Technology
1591847389,http://ecx.images-amazon.com/images/I/61o321z6GDL.jpg,Growth Hacker Marketing: A Primer on the Future of PR; Marketing; and Advertising,Ryan Holiday,Computers & Technology
735623430,http://ecx.images-amazon.com/images/I/51lOzIs5uwL.jpg,Take Back Your Life!: Using Microsoft Office Outlook 2007 to Get Organized and Stay Organized,Sally McGhee,Computers & Technology
1783983280,http://ecx.images-amazon.com/images/I/51C7ByxNtNL.jpg,MEAN Web Development,Amos Q. Haviv,Computers & Technology
71768858,http://ecx.images-amazon.com/images/I/51jsXgH2pGL.jpg,Oracle Database 11g & MySQL 5.6 Developer Handbook (Oracle Press),Michael McLaughlin,Computers & Technology
1466585021,http://ecx.images-amazon.com/images/I/51AewqYww5L.jpg,From Business Strategy to Information Technology Roadmap: A Practical Guide for Executives and Board Members,Tiffany Pham,Computers & Technology
1617290750,http://ecx.images-amazon.com/images/I/51KT4qErFaL.jpg,Single Page Web Applications: JavaScript end-to-end,Michael Mikowski,Computers & Technology
1490487255,http://ecx.images-amazon.com/images/I/61VCkXOCjIL.jpg,How to Use Microsoft SharePoint 2013 on Construction Projects,George O Okere PhD,Computers & Technology
735659877,http://ecx.images-amazon.com/images/I/51hhSsg7SUL.jpg,Microsoft Access 2010 VBA Programming Inside Out,Andrew Couch,Computers & Technology
1514196239,http://ecx.images-amazon.com/images/I/5178fq2DV3L.jpg,Anti Inflammatory Cookbook - 50 Slow Cooker Recipes With Anti - Inflammatory Ingredients: Great For Gout! (Slow Cooker Cookbooks),Kate Marsh,Cookbooks & Food & Wine
1849752621,http://ecx.images-amazon.com/images/I/51U6eq7vu4L.jpg,Oils and Vinegars: Discovering and Enjoying Gourmet Oils and Vinegars,Liz Franklin,Cookbooks & Food & Wine
162336583X,http://ecx.images-amazon.com/images/I/61INLFujcpL.jpg,Runner's World Meals on the Run: 150 energy-packed recipes in 30 minutes or less,Joanna Sayago Golub,Cookbooks & Food & Wine
1605537071,http://ecx.images-amazon.com/images/I/51jnErh-u9L.jpg,Great-Tasting Potatoes Cookbook,Editors of Favorite Name Brand Recipes,Cookbooks & Food & Wine
1456576097,http://ecx.images-amazon.com/images/I/417yWRlaelL.jpg,Unprocessed: How to achieve vibrant health and your ideal weight.,Chef AJ,Cookbooks & Food & Wine
1941868002,http://ecx.images-amazon.com/images/I/61QqmtDBSVL.jpg,Agricola Cookbook,Josh Thomsen,Cookbooks & Food & Wine
079382883X,http://ecx.images-amazon.com/images/I/51zi2q5JfbL.jpg,Leopard Geckos (Complete Herp Care),Gerald Merker,Crafts & Hobbies & Home
711232997,http://ecx.images-amazon.com/images/I/61c4EZtdtNL.jpg,The English Country House Garden,Marcus Harpur,Crafts & Hobbies & Home
1564967425,http://ecx.images-amazon.com/images/I/61zJetR%2BnFL.jpg,Mosaics Inside & Out: Patterns and Inspirations for 17 Mosaic Projects,Doreen Mastandrea,Crafts & Hobbies & Home
B003YCQCYE,http://ecx.images-amazon.com/images/I/51F1112Q6ML.jpg,How to Have a Big Wedding on a Small Budget,Diane Warner,Crafts & Hobbies & Home
393339157,http://ecx.images-amazon.com/images/I/51VIlqRy-VL.jpg,Straight on Till Morning: The Life of Beryl Markham,Mary S. Lovell,Engineering & Transportation
470288574,http://ecx.images-amazon.com/images/I/4189WdAPk7L.jpg,Geographic Information Analysis,David O'Sullivan,Engineering & Transportation
1931464561,http://ecx.images-amazon.com/images/I/517v2BAD4%2BL.jpg,The M1 Garand Rifle,Bruce N. Canfield,Engineering & Transportation
3527299963,http://ecx.images-amazon.com/images/I/41KnOm-%2BzmL.jpg,Stirring: Theory and Practice,Marko Zlokarnik,Engineering & Transportation
1569905142,http://ecx.images-amazon.com/images/I/411Fd0QEBhL.jpg,Materials Science of Polymers for Engineers 3E,Tim Osswald,Engineering & Transportation
71487816,http://ecx.images-amazon.com/images/I/511ImbQQBLL.jpg,Schaum's Outline of Fluid Mechanics (Schaum's Outlines),Merle Potter,Engineering & Transportation
313335427,http://ecx.images-amazon.com/images/I/51C16779N8L.jpg,Organ Transplantation (Health and Medical Issues Today),David Petechuk,Health & Fitness & Dieting
1594772592,http://ecx.images-amazon.com/images/I/51HI3R5ucDL.jpg,The Secret to Long Life in Your DNA: The Beljanski Approach to Cellular Health,Hervé Janecek Ph.D.,Health & Fitness & Dieting
1591200172,http://ecx.images-amazon.com/images/I/51F3KTDSSRL.jpg,Healing Without Medication: A Comprehensive Guide to the Complementary Techniques Anyone Can Use to Achieve Real Healing,Robert S. Rister,Health & Fitness & Dieting
047005333X,http://ecx.images-amazon.com/images/I/519W7i65J%2BL.jpg,Microbiologically Safe Foods,Jose Santos Garcia,Health & Fitness & Dieting
446581046,http://ecx.images-amazon.com/images/I/51KP8VqIdzL.jpg,Walking the Walk (w/DVD): Getting Fit with Faith,Leslie Sansone,Health & Fitness & Dieting
321910427,http://ecx.images-amazon.com/images/I/516Mn8i0SlL.jpg,Health: The Basics (11th Edition),Rebecca J. Donatelle,Health & Fitness & Dieting
470525452,http://ecx.images-amazon.com/images/I/51Mx0Zj7YDL.jpg,No More Fatigue: Why You're So Tired and What You Can Do About It,Jack Challem,Health & Fitness & Dieting
1940358035,http://ecx.images-amazon.com/images/I/51xZGUIv2mL.jpg,The 7-Day Flat-Belly Tea Cleanse: The Revolutionary New Plan to Melt Up to 10 Pounds of Fat in Just One Week!,Kelly Choi,Health & Fitness & Dieting
1133956602,http://ecx.images-amazon.com/images/I/51ddN9xBrhL.jpg,Introduction to Psychology,James W. Kalat,Health & Fitness & Dieting
1111350744,http://ecx.images-amazon.com/images/I/51m-36WTujL.jpg,Research Methods in Psychology,David G. Elmes,Health & Fitness & Dieting
345373537,http://ecx.images-amazon.com/images/I/51XM3KSMzJL.jpg,Dr. Dean Ornish's Program for Reversing Heart Disease,Dr. Dean Ornish,Health & Fitness & Dieting
1592401333,http://ecx.images-amazon.com/images/I/51ejVCQKyIL.jpg,Dark Nights of the Soul: A Guide to Finding Your Way Through Life's Ordeals,Thomas Moore,Health & Fitness & Dieting
1583333010,http://ecx.images-amazon.com/images/I/51MQLsnzz-L.jpg,Sleep: A Groundbreaking Guide to the Mysteries; the Problems; and the Solutions,Carlos H. Schenck,Health & Fitness & Dieting
752886096,http://ecx.images-amazon.com/images/I/41tmfMgTP3L.jpg,Untitled Harrold 2 of 3: The Hypnosis Solution for Deeper; Longer Sleep,Glenn Harrold,Health & Fitness & Dieting
1843109042,http://ecx.images-amazon.com/images/I/41UprSI-XwL.jpg,Adults on the Autism Spectrum Leave the Nest: Achieving Supported Independence,Nancy Perry,Health & Fitness & Dieting
1583334769,http://ecx.images-amazon.com/images/I/51FcTxeP8fL.jpg,Coping with Concussion and Mild Traumatic Brain Injury: A Guide to Living with the Challenges Associated with Post Concussion Syndrome and Brain Trauma,Diane Roberts Stoler,Health & Fitness & Dieting
1478701811,http://ecx.images-amazon.com/images/I/51FtwarlA6L.jpg,Numeralogical Lottery,Kathleen Margaret Adams,Health & Fitness & Dieting
019957202X,http://ecx.images-amazon.com/images/I/61Y4fPeaShL.jpg,Basic Vision: An Introduction to Visual Perception,Robert Snowden,Health & Fitness & Dieting
159477207X,http://ecx.images-amazon.com/images/I/51QeP19JErL.jpg,The Acupressure Atlas,Bernard C. Kolster M.D.,Health & Fitness & Dieting
093961667X,http://ecx.images-amazon.com/images/I/51Sp7wiEHnL.jpg,Chinese Herbal Medicine: Formulas & Strategies (2nd Ed.),Volker Scheid,Health & Fitness & Dieting
963370324,http://ecx.images-amazon.com/images/I/418DYQD25WL.jpg,The Calcium Factor: The Scientific Secret of Health and Youth,Robert R. Barefoot,Health & Fitness & Dieting
757003702,http://ecx.images-amazon.com/images/I/51BQxGcPIzL.jpg,The Natural Prostate Cure; Second Edition: A Practical Guide to Using Diet and Supplements for a Healthy Prostate,Roger Mason,Health & Fitness & Dieting
72319585,http://ecx.images-amazon.com/images/I/411ZXVB9QJL.jpg,Health Education and Health Promotion: Learner-Centered Instructional Strategies,Jerrold S Greenberg,Health & Fitness & Dieting
1888216468,http://ecx.images-amazon.com/images/I/51t0aUEe0tL.jpg,Battlefields of the Civil War Map,National Geographic Society,History
153003804,http://ecx.images-amazon.com/images/I/51JXp76wG1L.jpg,Diary of Anne Frank,Frances Goodrich,History
816057583,http://ecx.images-amazon.com/images/I/512NdDiYqZL.jpg,The Kuwaiti Oil Fires (Environmental Disasters),Kristine Hirschmann,History
1616080094,http://ecx.images-amazon.com/images/I/51s40bqSiWL.jpg,U.S. Army Special Forces Guide to Unconventional Warfare: Devices and Techniques for Incendiaries,Army,History
871137607,http://ecx.images-amazon.com/images/I/51EdPM0rHkL.jpg,Eat the Rich: A Treatise on Economics,P.  J. O'Rourke,Humor & Entertainment
385349297,http://ecx.images-amazon.com/images/I/41hJGXQAq%2BL.jpg,Reasons Mommy Drinks,Lyranda Martin-Evans,Humor & Entertainment
1594483809,http://ecx.images-amazon.com/images/I/61lX5yjQf%2BL.jpg,Well Enough Alone: A Cultural History of My Hypochondria,Jennifer Traig,Humor & Entertainment
1416594914,http://ecx.images-amazon.com/images/I/51hCxlTZ5EL.jpg,DAMAGES,Barry Werth,Law
1403973083,http://ecx.images-amazon.com/images/I/419TDqP99jL.jpg,A Terrible Revenge: The Ethnic Cleansing of the East European Germans,Alfred-Maurice de Zayas,Law
231153546,http://ecx.images-amazon.com/images/I/41ZD5vbOhFL.jpg,They Wished They Were Honest: The Knapp Commission and New York City Police Corruption,Michael F. Armstrong,Law
312556411,http://ecx.images-amazon.com/images/I/51uNnIlIwrL.jpg,Literature and Its Writers: A Compact Introduction to Fiction; Poetry; and Drama,Ann Charters,Literature & Fiction
1250036658,http://ecx.images-amazon.com/images/I/51-RntCdC-L.jpg,This Book Is Full of Spiders: Seriously; Dude; Don't Touch It (John Dies at the End),David Wong,Literature & Fiction
300200676,http://ecx.images-amazon.com/images/I/51QRtiFZJtL.jpg,Eternity's Sunrise: The Imaginative World of William Blake,Leo Damrosch,Literature & Fiction
674990854,http://ecx.images-amazon.com/images/I/41cuXWA04fL.jpg,Seneca: Epistles 66-92 (Loeb No. 76),Seneca,Literature & Fiction
1517486068,http://ecx.images-amazon.com/images/I/41dESb94nVL.jpg,For the Love of 2am: Poetry For Insomniacs,Zena A. White,Literature & Fiction
1517383706,http://ecx.images-amazon.com/images/I/41pnyAVQMCL.jpg,Never Forget About Me,Joseph Starzyk,Literature & Fiction
141192577,http://ecx.images-amazon.com/images/I/51I7IOwB%2BqL.jpg,The Sonnets and a Lover's Complaint (Hardcover Classics),William Shakespeare,Literature & Fiction
1630661619,http://ecx.images-amazon.com/images/I/41aM7wyC7RL.jpg,Looney Bin Incorporated,Marietta Rodgers,Literature & Fiction
323072534,http://ecx.images-amazon.com/images/I/41eD1Ln0KlL.jpg,Manual of High Risk Pregnancy and Delivery; 5e (Manual of High Risk Pregnancy & Delivery),Elizabeth S. Gilbert RNC  MS  FNPc,Medical Books
71825053,http://ecx.images-amazon.com/images/I/61x8Dfxs9CL.jpg,Basic and Clinical Pharmacology 13 E,Bertram Katzung,Medical Books
1593853084,http://ecx.images-amazon.com/images/I/41I2zm6GAyL.jpg,Treating Trauma and Traumatic Grief in Children and Adolescents,Judith A. Cohen,Medical Books
096781281X,http://ecx.images-amazon.com/images/I/511TCMQWH0L.jpg,Passing on Bypass Using External CounterPulsation : An FDA Cleared Alternative to Treat Heart Disease Without Surgery; Drugs or Angioplasty. SECOND EDITION,George J. Juetersonke,Medical Books
111827797X,http://ecx.images-amazon.com/images/I/51jrQ7p9bHL.jpg,The ADA Practical Guide to Soft Tissue Oral Disease,Michael A. Kahn,Medical Books
792338367,http://ecx.images-amazon.com/images/I/31m5vpdap1L.jpg,Biological Models in Radiopharmaceutical Development (Developments in Nuclear Medicine),R.M. Lambrecht,Medical Books
142320316X,http://ecx.images-amazon.com/images/I/51y9qRT4exL.jpg,Trigger Points (Quickstudy: Academic),Inc. BarCharts,Medical Books
1464111723,http://ecx.images-amazon.com/images/I/519HwDb%2BzoL.jpg,Exploring Psychology; 9th Edition,David G. Myers,Medical Books
470890460,http://ecx.images-amazon.com/images/I/51Jw2YLIQSL.jpg,Forensic Analytics: Methods and Techniques for Forensic Accounting Investigations,Mark Nigrini,Medical Books
982565062,http://ecx.images-amazon.com/images/I/51uJz4Jd-hL.jpg,The Crime Wave: Collected Nonfiction (The Ace Performer Collection series),Dashiell Hammett,Mystery & Thriller & Suspense
312089457,http://ecx.images-amazon.com/images/I/41ST0F0KHEL.jpg,Sherlock Holmes: The Major Stories with Contemporary Critical Essays (Bedford Series in History & Culture),Arthur Conan Doyle,Mystery & Thriller & Suspense
1885941404,http://ecx.images-amazon.com/images/I/51FB6K4S7WL.jpg,Challenge The Widow-Maker And Other Stories Of People In Peril,Clark Howard,Mystery & Thriller & Suspense
1476787263,http://ecx.images-amazon.com/images/I/51wLqV73eDL.jpg,The Sniper and the Wolf: A Sniper Elite Novel,Scott McEwen,Mystery & Thriller & Suspense
984817409,http://ecx.images-amazon.com/images/I/41rBl7D9YeL.jpg,The Trust Company,Paul N Stam,Mystery & Thriller & Suspense
691164126,http://ecx.images-amazon.com/images/I/41fBUGHemXL.jpg,On Conan Doyle: Or; The Whole Art of Storytelling (Writers on Writers),Michael Dirda,Mystery & Thriller & Suspense
037571894X,http://ecx.images-amazon.com/images/I/514y1ZCphZL.jpg,A Wild Sheep Chase: A Novel,Haruki Murakami,Mystery & Thriller & Suspense
985954051,http://ecx.images-amazon.com/images/I/41k9h2wMPEL.jpg,License to Lie,Terry Ambrose,Mystery & Thriller & Suspense
1401688888,http://ecx.images-amazon.com/images/I/51kwubDrxcL.jpg,A House Divided,Robert Whitlow,Mystery & Thriller & Suspense
62275496,http://ecx.images-amazon.com/images/I/51luHH98Z3L.jpg,Dorothy L. Sayers: The Complete Stories,Dorothy L. Sayers,Mystery & Thriller & Suspense
1250004101,http://ecx.images-amazon.com/images/I/51LrGk8EeML.jpg,Wicked Autumn: A Max Tudor Novel,G. M. Malliet,Mystery & Thriller & Suspense
1400095832,http://ecx.images-amazon.com/images/I/517YTQ0oXtL.jpg,The Man Who Smiled (Kurt Wallander Series),Henning Mankell,Mystery & Thriller & Suspense
